{
  "event_type": "fare_tap",
  "gate_section_id": "gate_01",
  "card_id_hash": "sha256:ab123456789012345678901234567890abcdef0123456789012345678901cdef",
  "timestamp": "2026-05-23T03:42:11.001234+00:00",
  "result": "approved",
  "raw_meta": {
    "fare_amount": 1370,
    "card_type": "T-money",
    "terminal_id": "term_001_a"
  }
}
